Cluster	Species	Genes with greater presence	Genes with less presence
Cluster 1	S. azizii, S. marmotae, S. minor, S. ovis, S. parasuis, S. sp. DD13, S. sp. LYSM12, S. sp. X13SY08, S. suis, S. varani	protein_description: hypothetical protein,hypothetical protein,putative protein	N/A
Cluster 2	S. Streptococcus, S. anginosus, S. cristatus, S. gordonii, S. himalayensis, S. intermedius, S. massiliensis, S. merionis, S. mitis, S. oralis, S. parasanguinis, S. pneumoniae, S. pseudopneumoniae, S. sanguinis, S. sp. DD10, S. sp. DD11, S. sp. F0442, S. sp. GMD4S, S. sp. GMD5S, S. sp. GMD6S, S. sp. HMSC34B10, S. sp. HSISM1, S. sp. JS71, S. sp. Marseille-P644, S. sp. NM, S. sp. VT 162, S. sp. WM07	comC1,comC2,lytB,lytB_1,lytB_2,pepE,smc_1,smc_2,smc_3,smc_5,tenA_1,tenA_2,yihX	N/A
Cluster 3	S. devriesei, S. ferus, S. macacae, S. marimammalium, S. mutans, S. ratti, S. sp. DD12, S. troglodytae	N/A	N/A
Cluster 4	S. entericus, S. halotolerans, S. hyovaginalis, S. pharyngis, S. plurextorum, S. porci, S. sp. 28462, S. sp. sy004, S. sp. sy010, S. sp. sy018, S. thoraltensis	N/A	N/A
Cluster 5	S. Streptococcus, S. criceti, S. hyointestinalis, S. sobrinus, S. sp. C150, S. sp. CCH8-H5, S. sp. HSISS2, S. thermophilus CAG	betI_1,betI_2,betI_3,betI_4,gloB,gloB_2,yflN,kefB,levS,recF,recF_1,recF_2,slmA	N/A
Cluster 6	S. Streptococcus, S. bovis, S. caballi, S. gallolyticus, S. henryi, S. macedonicus, S. orisratti, S. pantholopis, S. sp. HSISB1, S. sp. KCJ4950, S. sp. UBA3373, S. sp. UBA4344, S. sp. UBA632, S. sp. Z15	COQ5,COQ5_2,bioD1,bioY_1,cymR,iscR,cynR,cynR_1,cynR_2,hcaR,hdfR_1,ecdB,gabR_1,gabR_2,hisC_1,guaD,tadA_1,tadA_2,hosA,lpdC,metI_1,metI_2,mtnN_1,mtnN_2,pfs,nadA,nadA_1,nadA_2,nadB,nadB_1,nadB_2,panD,slyA,slyA_1,slyA_2,slyA_3,ssp5,ssuC,strA_1,strA_2,strA_3,yeeO_1,yeeO_2,yeeO_3,yeeO_4	N/A
Cluster 7	S. bovimastitidis, S. castoreus, S. didelphis, S. dysgalactiae, S. equi subsp. ruminatorum, S. ictaluri, S. iniae, S. parauberis, S. phocae, S. pseudoporcinus, S. pyogenes, S. uberis, S. urinalis	pnuC	N/A
Cluster 8	S. agalactiae	COQ3,COQ5_1,COQ5_2,MENG,ykoE	N/A
